{
  "$schema": "./tecpey-mentor-rig-manifest.v1.schema.json",
  "manifestVersion": "1.0.0",
  "status": "signoff_candidate",
  "asset": {
    "assetId": "tecpey_mentor_global",
    "assetVersion": "0.1.0",
    "sourceFile": "tecpey-mentor-global.v1.riv",
    "rootComponent": "MentorCore",
    "rootViewModel": "TecPeyMentorVM",
    "stateMachine": "MentorStateMachine",
    "compatibleViewModel": ">=1.0.0 <2.0.0",
    "compatibleSpeechRig": ">=1.0.0 <2.0.0"
  },
  "requiredNodes": [
    "MentorCore",
    "MentorLauncher",
    "MentorPanel",
    "MentorProfile",
    "MentorScene",
    "MentorShare",
    "grp_shadow",
    "grp_character",
    "grp_body_back",
    "geo_arm_R_back",
    "geo_torso_back",
    "grp_torso",
    "mesh_torso",
    "geo_neck",
    "geo_shirt_trim",
    "grp_head",
    "geo_ear_L",
    "geo_ear_R",
    "mesh_face_base",
    "geo_nose_identity",
    "grp_eye_L",
    "grp_eye_R",
    "grp_brow_L",
    "grp_brow_R",
    "grp_mouth",
    "mask_mouth_cavity",
    "geo_mouth_cavity",
    "geo_teeth_upper",
    "geo_teeth_lower",
    "geo_tongue",
    "geo_lip_upper",
    "geo_lip_lower",
    "mesh_lower_face_speech",
    "mesh_beard_lower",
    "geo_hair_back",
    "geo_hair_front",
    "grp_body_front",
    "geo_arm_L_front",
    "cmp_hand_L",
    "cmp_hand_R",
    "grp_controls",
    "grp_skeleton",
    "grp_debug"
  ],
  "artboards": [
    {
      "id": "mentor_core",
      "name": "MentorCore",
      "role": "reusable_core",
      "referenceSize": { "width": 1024, "height": 1024 },
      "instanceOf": null,
      "delivery": "animated",
      "defaultRuntimeMode": "component_only"
    },
    {
      "id": "mentor_launcher",
      "name": "MentorLauncher",
      "role": "launcher",
      "referenceSize": { "width": 256, "height": 256 },
      "instanceOf": "MentorCore",
      "delivery": "static_export",
      "defaultRuntimeMode": "static"
    },
    {
      "id": "mentor_panel",
      "name": "MentorPanel",
      "role": "panel",
      "referenceSize": { "width": 720, "height": 960 },
      "instanceOf": "MentorCore",
      "delivery": "animated",
      "defaultRuntimeMode": "load_on_intent"
    },
    {
      "id": "mentor_profile",
      "name": "MentorProfile",
      "role": "profile",
      "referenceSize": { "width": 960, "height": 960 },
      "instanceOf": "MentorCore",
      "delivery": "animated",
      "defaultRuntimeMode": "load_when_visible"
    },
    {
      "id": "mentor_scene",
      "name": "MentorScene",
      "role": "scene",
      "referenceSize": { "width": 1440, "height": 900 },
      "instanceOf": "MentorCore",
      "delivery": "animated",
      "defaultRuntimeMode": "load_when_visible"
    },
    {
      "id": "mentor_share",
      "name": "MentorShare",
      "role": "share",
      "referenceSize": { "width": 1080, "height": 1920 },
      "instanceOf": "MentorCore",
      "delivery": "deferred",
      "defaultRuntimeMode": "deferred"
    }
  ],
  "surfaceBindings": [
    {
      "surface": "launcher",
      "artboard": "MentorLauncher",
      "loadPolicy": "static_until_open",
      "maxAnimatedInstances": 0,
      "fallback": "static_launcher_svg"
    },
    {
      "surface": "mentor_tab",
      "artboard": "MentorPanel",
      "loadPolicy": "on_intent",
      "maxAnimatedInstances": 1,
      "fallback": "static_neutral_poster"
    },
    {
      "surface": "profile_summary",
      "artboard": "MentorProfile",
      "loadPolicy": "when_visible",
      "maxAnimatedInstances": 1,
      "fallback": "static_neutral_poster"
    },
    {
      "surface": "academy",
      "artboard": "MentorScene",
      "loadPolicy": "when_visible",
      "maxAnimatedInstances": 1,
      "fallback": "static_neutral_poster"
    },
    {
      "surface": "arena",
      "artboard": "MentorScene",
      "loadPolicy": "when_visible",
      "maxAnimatedInstances": 1,
      "fallback": "static_neutral_poster"
    },
    {
      "surface": "credential_helper",
      "artboard": "MentorPanel",
      "loadPolicy": "on_intent",
      "maxAnimatedInstances": 1,
      "fallback": "host_ui_only"
    },
    {
      "surface": "share_render",
      "artboard": "MentorShare",
      "loadPolicy": "deferred_phase_6",
      "maxAnimatedInstances": 1,
      "fallback": "host_ui_only"
    }
  ],
  "layers": [
    {
      "indexTopToBottom": 0,
      "name": "Ambient",
      "priorityRank": 10,
      "defaultState": "still",
      "states": ["off", "still", "breathe"],
      "ownerDomains": ["body.breath", "clothing.secondary"],
      "intentionalOverrides": [],
      "interruptible": true
    },
    {
      "indexTopToBottom": 1,
      "name": "ConversationAct",
      "priorityRank": 30,
      "defaultState": "idle_attentive",
      "states": [
        "idle_attentive",
        "greet",
        "listen",
        "think",
        "explain",
        "invite_next_step",
        "celebrate_effort",
        "encourage_retry"
      ],
      "ownerDomains": ["body.pose", "arms.pose", "hands.pose", "head.act"],
      "intentionalOverrides": [],
      "interruptible": true
    },
    {
      "indexTopToBottom": 2,
      "name": "FaceAffect",
      "priorityRank": 40,
      "defaultState": "calm",
      "states": ["calm", "attentive", "curious", "warm", "concerned", "steady"],
      "ownerDomains": ["brows.expression", "cheeks.upper", "mouth.expression"],
      "intentionalOverrides": [],
      "interruptible": true
    },
    {
      "indexTopToBottom": 3,
      "name": "GazeBlink",
      "priorityRank": 50,
      "defaultState": "still",
      "states": ["still", "auto", "focus"],
      "ownerDomains": ["eyes.gaze", "eyes.lids", "head.aim"],
      "intentionalOverrides": [],
      "interruptible": true
    },
    {
      "indexTopToBottom": 4,
      "name": "Speech",
      "priorityRank": 60,
      "defaultState": "sil",
      "states": [
        "sil",
        "bilabial",
        "labiodental",
        "interdental",
        "alveolar",
        "velar",
        "postalveolar",
        "sibilant",
        "nasal_lateral",
        "rhotic",
        "vowel_open",
        "vowel_mid_front",
        "vowel_close_front",
        "vowel_mid_back_round",
        "vowel_close_back_round",
        "recover"
      ],
      "ownerDomains": [
        "jaw.articulation",
        "mouth.articulation",
        "teeth.visibility",
        "tongue.articulation",
        "cheeks.lower"
      ],
      "intentionalOverrides": [],
      "interruptible": true
    },
    {
      "indexTopToBottom": 5,
      "name": "SafetyBase",
      "priorityRank": 100,
      "defaultState": "clear",
      "states": [
        "clear",
        "pause_reflect",
        "risk_caution",
        "privacy_notice",
        "data_unavailable",
        "error_recover"
      ],
      "ownerDomains": [],
      "intentionalOverrides": ["body.pose", "arms.pose", "hands.pose", "head.act"],
      "interruptible": true
    }
  ],
  "bones": [
    { "id": "b_root", "parent": null, "role": "structural", "normalOwner": null, "deforming": false },
    { "id": "b_torso_root", "parent": "b_root", "role": "structural", "normalOwner": null, "deforming": true },
    { "id": "b_spine_act", "parent": "b_torso_root", "role": "body_pose", "normalOwner": "ConversationAct", "deforming": true },
    { "id": "b_breath", "parent": "b_spine_act", "role": "breath", "normalOwner": "Ambient", "deforming": true },
    { "id": "b_chest", "parent": "b_spine_act", "role": "body_pose", "normalOwner": "ConversationAct", "deforming": true },
    { "id": "b_neck", "parent": "b_chest", "role": "body_pose", "normalOwner": "ConversationAct", "deforming": false },
    { "id": "b_head_act", "parent": "b_neck", "role": "head_act", "normalOwner": "ConversationAct", "deforming": false },
    { "id": "b_head_aim", "parent": "b_head_act", "role": "head_aim", "normalOwner": "GazeBlink", "deforming": false },
    { "id": "b_head", "parent": "b_head_aim", "role": "structural", "normalOwner": null, "deforming": true },
    { "id": "b_jaw", "parent": "b_head", "role": "jaw", "normalOwner": "Speech", "deforming": true },
    { "id": "b_clavicle_L", "parent": "b_chest", "role": "arm", "normalOwner": "ConversationAct", "deforming": true },
    { "id": "b_clavicle_R", "parent": "b_chest", "role": "arm", "normalOwner": "ConversationAct", "deforming": true },
    { "id": "b_upperarm_L", "parent": "b_clavicle_L", "role": "arm", "normalOwner": "ConversationAct", "deforming": true },
    { "id": "b_upperarm_R", "parent": "b_clavicle_R", "role": "arm", "normalOwner": "ConversationAct", "deforming": true },
    { "id": "b_forearm_L", "parent": "b_upperarm_L", "role": "arm", "normalOwner": "ConversationAct", "deforming": true },
    { "id": "b_forearm_R", "parent": "b_upperarm_R", "role": "arm", "normalOwner": "ConversationAct", "deforming": true },
    { "id": "b_wrist_L", "parent": "b_forearm_L", "role": "arm", "normalOwner": "ConversationAct", "deforming": true },
    { "id": "b_wrist_R", "parent": "b_forearm_R", "role": "arm", "normalOwner": "ConversationAct", "deforming": true },
    { "id": "b_hand_L", "parent": "b_wrist_L", "role": "hand", "normalOwner": "ConversationAct", "deforming": false },
    { "id": "b_hand_R", "parent": "b_wrist_R", "role": "hand", "normalOwner": "ConversationAct", "deforming": false },
    { "id": "b_mouth_corner_L", "parent": "b_head", "role": "mouth_affect", "normalOwner": "FaceAffect", "deforming": true },
    { "id": "b_mouth_corner_R", "parent": "b_head", "role": "mouth_affect", "normalOwner": "FaceAffect", "deforming": true },
    { "id": "b_lip_upper_mid", "parent": "b_head", "role": "mouth_speech", "normalOwner": "Speech", "deforming": true },
    { "id": "b_lip_lower_mid", "parent": "b_jaw", "role": "mouth_speech", "normalOwner": "Speech", "deforming": true },
    { "id": "b_brow_inner_L", "parent": "b_head", "role": "brow", "normalOwner": "FaceAffect", "deforming": true },